id,Titre,Date,Pays,Director,acteurs,note,Decennie
tt0111161,Les Évadés,1994,United States,Frank Darabont,"Tim Robbins, Morgan Freeman, Bob Gunton",9.3,"[1990, 2000)"
tt0068646,Le Parrain,1972,United States,Francis Ford Coppola,"Marlon Brando, Al Pacino, James Caan",9.2,"[1970, 1980)"
tt0468569,The Dark Knight : Le Chevalier noir,2008,United States,Christopher Nolan,"Christian Bale, Heath Ledger, Aaron Eckhart",9.0,"[2000, 2010)"
tt0071562,"Le Parrain, 2ᵉ partie",1974,United States,Francis Ford Coppola,"Al Pacino, Robert De Niro, Robert Duvall",9.0,"[1970, 1980)"
tt0050083,12 Hommes en colère,1957,United States,Sidney Lumet,"Henry Fonda, Lee J. Cobb, Martin Balsam",9.0,"[1950, 1960)"
tt0108052,La liste de Schindler,1993,United States,Steven Spielberg,"Liam Neeson, Ralph Fiennes, Ben Kingsley",9.0,"[1990, 2000)"
tt0167260,Le Seigneur des anneaux : Le Retour du roi,2003,New Zealand,Peter Jackson,"Elijah Wood, Viggo Mortensen, Ian McKellen",9.0,"[2000, 2010)"
tt0110912,Pulp Fiction,1994,United States,Quentin Tarantino,"John Travolta, Uma Thurman, Samuel L. Jackson",8.9,"[1990, 2000)"
tt0120737,Le Seigneur des anneaux : La Communauté de l'anneau,2001,New Zealand,Peter Jackson,"Elijah Wood, Ian McKellen, Orlando Bloom",8.8,"[2000, 2010)"
tt0060196,"Le Bon, la brute, le truand",1966,Italy,Sergio Leone,"Clint Eastwood, Eli Wallach, Lee Van Cleef",8.8,"[1960, 1970)"
tt0109830,Forrest Gump,1994,United States,Robert Zemeckis,"Tom Hanks, Robin Wright, Gary Sinise",8.8,"[1990, 2000)"
tt0137523,Fight Club,1999,Germany,David Fincher,"Brad Pitt, Edward Norton, Meat Loaf",8.8,"[1990, 2000)"
tt0167261,Le Seigneur des anneaux : Les Deux Tours,2002,New Zealand,Peter Jackson,"Elijah Wood, Ian McKellen, Viggo Mortensen",8.8,"[2000, 2010)"
tt1375666,Inception,2010,United States,Christopher Nolan,"Leonardo DiCaprio, Joseph Gordon-Levitt, Elliot Page",8.8,"[2010, 2020)"
tt0080684,L'Empire contre-attaque,1980,United States,Irvin Kershner,"Mark Hamill, Harrison Ford, Carrie Fisher",8.7,"[1980, 1990)"
tt0133093,Matrix,1999,United States,"Lana Wachowski, Lilly Wachowski","Keanu Reeves, Laurence Fishburne, Carrie-Anne Moss",8.7,"[1990, 2000)"
tt0099685,Les affranchis,1990,United States,Martin Scorsese,"Robert De Niro, Ray Liotta, Joe Pesci",8.7,"[1990, 2000)"
tt0073486,Vol au-dessus d'un nid de coucou,1975,United States,Milos Forman,"Jack Nicholson, Louise Fletcher, Michael Berryman",8.7,"[1970, 1980)"
tt0114369,Seven,1995,United States,David Fincher,"Morgan Freeman, Brad Pitt, Kevin Spacey",8.6,"[1990, 2000)"
tt0038650,La vie est belle,1946,United States,Frank Capra,"James Stewart, Donna Reed, Lionel Barrymore",8.6,"[1940, 1950)"
tt0047478,Les 7 Samouraïs,1954,Japan,Akira Kurosawa,"Toshirô Mifune, Takashi Shimura, Keiko Tsushima",8.6,"[1950, 1960)"
tt0102926,Le Silence des agneaux,1991,United States,Jonathan Demme,"Jodie Foster, Anthony Hopkins, Lawrence A. Bonney",8.6,"[1990, 2000)"
tt0120815,Il faut sauver le soldat Ryan,1998,United States,Steven Spielberg,"Tom Hanks, Matt Damon, Tom Sizemore",8.6,"[1990, 2000)"
tt0317248,La cité de Dieu,2002,Brazil,"Fernando Meirelles, Kátia Lund","Alexandre Rodrigues, Leandro Firmino, Matheus Nachtergaele",8.6,"[2000, 2010)"
tt0816692,Interstellar,2014,United States,Christopher Nolan,"Matthew McConaughey, Anne Hathaway, Jessica Chastain",8.6,"[2010, 2020)"
tt0118799,La vie est belle,1997,Italy,Roberto Benigni,"Roberto Benigni, Nicoletta Braschi, Giorgio Cantarini",8.6,"[1990, 2000)"
tt0120689,La ligne verte,1999,United States,Frank Darabont,"Tom Hanks, Michael Clarke Duncan, David Morse",8.6,"[1990, 2000)"
tt0076759,La guerre des étoiles,1977,United States,George Lucas,"Mark Hamill, Harrison Ford, Carrie Fisher",8.6,"[1970, 1980)"
tt0103064,Terminator 2 : Le jugement dernier,1991,United States,James Cameron,"Arnold Schwarzenegger, Linda Hamilton, Edward Furlong",8.6,"[1990, 2000)"
tt0088763,Retour vers le futur,1985,United States,Robert Zemeckis,"Michael J. Fox, Christopher Lloyd, Lea Thompson",8.5,"[1980, 1990)"
tt0245429,Le voyage de Chihiro,2001,Japan,Hayao Miyazaki,"Daveigh Chase, Suzanne Pleshette, Miyu Irino",8.6,"[2000, 2010)"
tt0253474,Le pianiste,2002,France,Roman Polanski,"Adrien Brody, Thomas Kretschmann, Frank Finlay",8.5,"[2000, 2010)"
tt0054215,Psychose,1960,United States,Alfred Hitchcock,"Anthony Perkins, Janet Leigh, Vera Miles",8.5,"[1960, 1970)"
tt6751668,Parasite,2019,South Korea,Bong Joon Ho,"Song Kang-ho, Lee Sun-kyun, Cho Yeo-jeong",8.5,"[2010, 2020)"
tt0110413,Léon,1994,France,Luc Besson,"Jean Reno, Gary Oldman, Natalie Portman",8.5,"[1990, 2000)"
tt0110357,Le Roi Lion,1994,United States,"Roger Allers, Rob Minkoff","Matthew Broderick, Jeremy Irons, James Earl Jones",8.5,"[1990, 2000)"
tt0172495,Gladiator,2000,United States,Ridley Scott,"Russell Crowe, Joaquin Phoenix, Connie Nielsen",8.5,"[2000, 2010)"
tt0120586,American History X,1998,United States,Tony Kaye,"Edward Norton, Edward Furlong, Beverly D'Angelo",8.5,"[1990, 2000)"
tt0407887,Les infiltrés,2006,United States,Martin Scorsese,"Leonardo DiCaprio, Matt Damon, Jack Nicholson",8.5,"[2000, 2010)"
tt2582802,Whiplash,2014,United States,Damien Chazelle,"Miles Teller, J.K. Simmons, Melissa Benoist",8.5,"[2010, 2020)"
tt0482571,Le Prestige,2006,United Kingdom,Christopher Nolan,"Christian Bale, Hugh Jackman, Scarlett Johansson",8.5,"[2000, 2010)"
tt0114814,Usual Suspects,1995,United States,Bryan Singer,"Kevin Spacey, Gabriel Byrne, Chazz Palminteri",8.5,"[1990, 2000)"
tt0034583,Casablanca,1942,United States,Michael Curtiz,"Humphrey Bogart, Ingrid Bergman, Paul Henreid",8.5,"[1940, 1950)"
tt0095327,Le tombeau des lucioles,1988,Japan,Isao Takahata,"Tsutomu Tatsumi, Ayano Shiraishi, Akemi Yamaguchi",8.5,"[1980, 1990)"
tt0056058,Harakiri,1962,Japan,Masaki Kobayashi,"Tatsuya Nakadai, Akira Ishihama, Shima Iwashita",8.6,"[1960, 1970)"
tt1675434,Intouchables,2011,France,"Olivier Nakache, Éric Toledano","François Cluzet, Omar Sy, Anne Le Ny",8.5,"[2010, 2020)"
tt0027977,Les temps modernes,1936,United States,Charles Chaplin,"Charles Chaplin, Paulette Goddard, Henry Bergman",8.5,"[1930, 1940)"
tt0064116,Il était une fois dans l'Ouest,1968,Italy,Sergio Leone,"Henry Fonda, Charles Bronson, Claudia Cardinale",8.5,"[1960, 1970)"
tt0095765,Cinéma Paradiso,1988,Italy,Giuseppe Tornatore,"Philippe Noiret, Enzo Cannavale, Antonella Attili",8.5,"[1980, 1990)"
tt0047396,Fenêtre sur cour,1954,United States,Alfred Hitchcock,"James Stewart, Grace Kelly, Wendell Corey",8.5,"[1950, 1960)"
tt0078748,Alien - Le 8ème passager,1979,United Kingdom,Ridley Scott,"Sigourney Weaver, Tom Skerritt, John Hurt",8.5,"[1970, 1980)"
tt0021749,Les lumières de la ville,1931,United States,Charles Chaplin,"Charles Chaplin, Virginia Cherrill, Florence Lee",8.5,"[1930, 1940)"
tt0078788,Apocalypse Now,1979,United States,Francis Ford Coppola,"Martin Sheen, Marlon Brando, Robert Duvall",8.5,"[1970, 1980)"
tt0209144,Memento,2000,United States,Christopher Nolan,"Guy Pearce, Carrie-Anne Moss, Joe Pantoliano",8.4,"[2000, 2010)"
tt1853728,Django Unchained,2012,United States,Quentin Tarantino,"Jamie Foxx, Christoph Waltz, Leonardo DiCaprio",8.4,"[2010, 2020)"
tt0082971,Les Aventuriers de l'arche perdue,1981,United States,Steven Spielberg,"Harrison Ford, Karen Allen, Paul Freeman",8.4,"[1980, 1990)"
tt0910970,WALL·E,2008,United States,Andrew Stanton,"Ben Burtt, Elissa Knight, Jeff Garlin",8.4,"[2000, 2010)"
tt0405094,La vie des autres,2006,Germany,Florian Henckel von Donnersmarck,"Ulrich Mühe, Martina Gedeck, Sebastian Koch",8.4,"[2000, 2010)"
tt0043014,Boulevard du Crépuscule,1950,United States,Billy Wilder,"William Holden, Gloria Swanson, Erich von Stroheim",8.4,"[1950, 1960)"
tt0050825,Les sentiers de la gloire,1957,United States,Stanley Kubrick,"Kirk Douglas, Ralph Meeker, Adolphe Menjou",8.4,"[1950, 1960)"
tt0081505,Shining,1980,United Kingdom,Stanley Kubrick,"Jack Nicholson, Shelley Duvall, Danny Lloyd",8.4,"[1980, 1990)"
tt0032553,Le dictateur,1940,United States,Charles Chaplin,"Charles Chaplin, Paulette Goddard, Jack Oakie",8.4,"[1940, 1950)"
tt4154756,Avengers: Infinity War,2018,United States,"Anthony Russo, Joe Russo","Robert Downey Jr., Chris Hemsworth, Mark Ruffalo",8.4,"[2010, 2020)"
tt0051201,Témoin à charge,1957,United States,Billy Wilder,"Tyrone Power, Marlene Dietrich, Charles Laughton",8.4,"[1950, 1960)"
tt0090605,Aliens : Le Retour,1986,United Kingdom,James Cameron,"Sigourney Weaver, Michael Biehn, Carrie Henn",8.4,"[1980, 1990)"
tt4633694,Spider-Man: New Generation,2018,Canada,"Bob Persichetti, Peter Ramsey, Rodney Rothman","Shameik Moore, Jake Johnson, Hailee Steinfeld",8.4,"[2010, 2020)"
tt0169547,American Beauty,1999,United States,Sam Mendes,"Kevin Spacey, Annette Bening, Thora Birch",8.4,"[1990, 2000)"
tt0057012,Dr. Folamour ou : Comment j'ai appris à ne plus m'en faire et à aimer la bombe !,1964,United Kingdom,Stanley Kubrick,"Peter Sellers, George C. Scott, Sterling Hayden",8.4,"[1960, 1970)"
tt1345836,The Dark Knight Rises,2012,United States,Christopher Nolan,"Christian Bale, Tom Hardy, Anne Hathaway",8.4,"[2010, 2020)"
tt0364569,Old Boy,2003,South Korea,Park Chan-wook,"Choi Min-sik, Yoo Ji-tae, Kang Hye-jeong",8.4,"[2000, 2010)"
tt0361748,Inglourious Basterds,2009,Germany,Quentin Tarantino,"Brad Pitt, Diane Kruger, Eli Roth",8.3,"[2000, 2010)"
tt0086879,Amadeus,1984,United States,Milos Forman,"F. Murray Abraham, Tom Hulce, Elizabeth Berridge",8.4,"[1980, 1990)"
tt2380307,Coco,2017,United States,"Lee Unkrich, Adrian Molina","Anthony Gonzalez, Gael García Bernal, Benjamin Bratt",8.4,"[2010, 2020)"
tt0114709,Toy Story,1995,United States,John Lasseter,"Tom Hanks, Tim Allen, Don Rickles",8.3,"[1990, 2000)"
tt0112573,Braveheart,1995,United States,Mel Gibson,"Mel Gibson, Sophie Marceau, Patrick McGoohan",8.4,"[1990, 2000)"
tt7286456,Joker,2019,United States,Todd Phillips,"Joaquin Phoenix, Robert De Niro, Zazie Beetz",8.4,"[2010, 2020)"
tt0082096,Le Bateau,1981,West Germany,Wolfgang Petersen,"Jürgen Prochnow, Herbert Grönemeyer, Klaus Wennemann",8.4,"[1980, 1990)"
tt4154796,Avengers: Endgame,2019,United States,"Anthony Russo, Joe Russo","Robert Downey Jr., Chris Evans, Mark Ruffalo",8.4,"[2010, 2020)"
tt0119698,Princesse Mononoké,1997,Japan,Hayao Miyazaki,"Yôji Matsuda, Yuriko Ishida, Yûko Tanaka",8.3,"[1990, 2000)"
tt0087843,Il était une fois en Amérique,1984,Italy,Sergio Leone,"Robert De Niro, James Woods, Elizabeth McGovern",8.3,"[1980, 1990)"
tt0119217,Will Hunting,1997,United States,Gus Van Sant,"Robin Williams, Matt Damon, Ben Affleck",8.3,"[1990, 2000)"
tt5311514,Your Name.,2016,Japan,Makoto Shinkai,"Ryunosuke Kamiki, Mone Kamishiraishi, Ryo Narita",8.4,"[2010, 2020)"
tt0045152,Chantons sous la pluie,1952,United States,"Stanley Donen, Gene Kelly","Gene Kelly, Donald O'Connor, Debbie Reynolds",8.3,"[1950, 1960)"
tt1187043,3 Idiots,2009,India,Rajkumar Hirani,"Aamir Khan, Madhavan, Mona Singh",8.4,"[2000, 2010)"
tt0180093,Requiem for a Dream,2000,United States,Darren Aronofsky,"Ellen Burstyn, Jared Leto, Jennifer Connelly",8.3,"[2000, 2010)"
tt0057565,Entre le ciel et l'enfer,1963,Japan,Akira Kurosawa,"Toshirô Mifune, Yutaka Sada, Tatsuya Nakadai",8.4,"[1960, 1970)"
tt0435761,Toy Story 3,2010,United States,Lee Unkrich,"Tom Hanks, Tim Allen, Joan Cusack",8.3,"[2010, 2020)"
tt8267604,Capharnaüm,2018,Lebanon,Nadine Labaki,"Zain Al Rafeea, Yordanos Shiferaw, Boluwatife Treasure Bankole",8.4,"[2010, 2020)"
tt0086190,Le Retour du Jedi,1983,United States,Richard Marquand,"Mark Hamill, Harrison Ford, Carrie Fisher",8.3,"[1980, 1990)"
tt0062622,2001 : L'Odyssée de l'espace,1968,United Kingdom,Stanley Kubrick,"Keir Dullea, Gary Lockwood, William Sylvester",8.3,"[1960, 1970)"
tt0338013,Eternal Sunshine of the Spotless Mind,2004,United States,Michel Gondry,"Jim Carrey, Kate Winslet, Tom Wilkinson",8.3,"[2000, 2010)"
tt0091251,Requiem pour un massacre - Va et regarde,1985,Soviet Union,Elem Klimov,"Aleksey Kravchenko, Olga Mironova, Liubomiras Laucevicius",8.4,"[1980, 1990)"
tt0105236,Reservoir Dogs,1992,United States,Quentin Tarantino,"Harvey Keitel, Tim Roth, Michael Madsen",8.3,"[1990, 2000)"
tt2106476,La chasse,2012,Denmark,Thomas Vinterberg,"Mads Mikkelsen, Thomas Bo Larsen, Annika Wedderkopp",8.3,"[2010, 2020)"
tt0033467,Citizen Kane,1941,United States,Orson Welles,"Orson Welles, Joseph Cotten, Dorothy Comingore",8.3,"[1940, 1950)"
tt0056172,Lawrence d'Arabie,1962,United Kingdom,David Lean,"Peter O'Toole, Alec Guinness, Anthony Quinn",8.3,"[1960, 1970)"
tt0022100,M le maudit,1931,Germany,Fritz Lang,"Peter Lorre, Ellen Widmann, Inge Landgut",8.3,"[1930, 1940)"
tt0044741,Vivre,1952,Japan,Akira Kurosawa,"Takashi Shimura, Nobuo Kaneko, Shin'ichi Himori",8.3,"[1950, 1960)"
tt0053125,La mort aux trousses,1959,United States,Alfred Hitchcock,"Cary Grant, Eva Marie Saint, James Mason",8.3,"[1950, 1960)"
tt0052357,Sueurs froides,1958,United States,Alfred Hitchcock,"James Stewart, Kim Novak, Barbara Bel Geddes",8.3,"[1950, 1960)"
tt0053604,La garçonnière,1960,United States,Billy Wilder,"Jack Lemmon, Shirley MacLaine, Fred MacMurray",8.3,"[1960, 1970)"
tt0211915,Le fabuleux destin d'Amélie Poulain,2001,France,Jean-Pierre Jeunet,"Audrey Tautou, Mathieu Kassovitz, Rufus",8.3,"[2000, 2010)"
tt0036775,Assurance sur la mort,1944,United States,Billy Wilder,"Fred MacMurray, Barbara Stanwyck, Edward G. Robinson",8.3,"[1940, 1950)"
tt0066921,Orange mécanique,1971,United Kingdom,Stanley Kubrick,"Malcolm McDowell, Patrick Magee, Michael Bates",8.3,"[1970, 1980)"
tt0093058,Full Metal Jacket,1987,United Kingdom,Stanley Kubrick,"Matthew Modine, R. Lee Ermey, Vincent D'Onofrio",8.3,"[1980, 1990)"
tt0086250,Scarface,1983,United States,Brian De Palma,"Al Pacino, Michelle Pfeiffer, Steven Bauer",8.3,"[1980, 1990)"
tt8503618,Hamilton,2020,United States,Thomas Kail,"Lin-Manuel Miranda, Phillipa Soo, Leslie Odom Jr.",8.4,
tt1255953,Incendies,2010,Canada,Denis Villeneuve,"Lubna Azabal, Mélissa Désormeaux-Poulin, Maxim Gaudette",8.3,"[2010, 2020)"
tt0113277,Heat,1995,United States,Michael Mann,"Al Pacino, Robert De Niro, Val Kilmer",8.3,"[1990, 2000)"
tt0056592,Du silence et des ombres...,1962,United States,Robert Mulligan,"Gregory Peck, John Megna, Frank Overton",8.3,"[1960, 1970)"
tt1049413,Là-haut,2009,United States,"Pete Docter, Bob Peterson","Edward Asner, Jordan Nagai, John Ratzenberger",8.3,"[2000, 2010)"
tt0070735,L'Arnaque,1973,United States,George Roy Hill,"Paul Newman, Robert Redford, Robert Shaw",8.3,"[1970, 1980)"
tt1832382,Une séparation,2011,Iran,Asghar Farhadi,"Payman Maadi, Leila Hatami, Sareh Bayat",8.3,"[2010, 2020)"
tt0017136,Metropolis,1927,Germany,Fritz Lang,"Brigitte Helm, Alfred Abel, Gustav Fröhlich",8.3,"[1920, 1930)"
tt0119488,L.A. Confidential,1997,United States,Curtis Hanson,"Kevin Spacey, Russell Crowe, Guy Pearce",8.2,"[1990, 2000)"
tt0095016,Piège de cristal,1988,United States,John McTiernan,"Bruce Willis, Alan Rickman, Bonnie Bedelia",8.2,"[1980, 1990)"
tt0075314,Taxi Driver,1976,United States,Martin Scorsese,"Robert De Niro, Jodie Foster, Cybill Shepherd",8.2,"[1970, 1980)"
tt0097576,Indiana Jones et la dernière croisade,1989,United States,Steven Spielberg,"Harrison Ford, Sean Connery, Alison Doody",8.2,"[1980, 1990)"
tt0208092,Snatch - Tu braques ou tu raques,2000,United Kingdom,Guy Ritchie,"Jason Statham, Brad Pitt, Stephen Graham",8.2,"[2000, 2010)"
tt0040522,Voleur de bicyclette,1948,Italy,Vittorio De Sica,"Lamberto Maggiorani, Enzo Staiola, Lianella Carell",8.3,"[1940, 1950)"
tt0986264,Taare Zameen Par,2007,India,"Aamir Khan, Amole Gupte","Darsheel Safary, Aamir Khan, Tanay Chheda",8.3,"[2000, 2010)"
tt8579674,1917,2019,United Kingdom,Sam Mendes,"Dean-Charles Chapman, George MacKay, Daniel Mays",8.2,"[2010, 2020)"
tt1745960,Top Gun: Maverick,2022,United States,Joseph Kosinski,"Tom Cruise, Jennifer Connelly, Miles Teller",8.3,
tt0363163,La chute,2004,Germany,Oliver Hirschbiegel,"Bruno Ganz, Alexandra Maria Lara, Ulrich Matthes",8.2,"[2000, 2010)"
tt5074352,Dangal,2016,India,Nitesh Tiwari,"Aamir Khan, Sakshi Tanwar, Fatima Sana Shaikh",8.3,"[2010, 2020)"
tt0059578,...et pour quelques dollars de plus,1965,Italy,Sergio Leone,"Clint Eastwood, Lee Van Cleef, Gian Maria Volontè",8.2,"[1960, 1970)"
tt0372784,Batman Begins,2005,United States,Christopher Nolan,"Christian Bale, Michael Caine, Ken Watanabe",8.2,"[2000, 2010)"
tt0012349,Le Kid,1921,United States,Charles Chaplin,"Charles Chaplin, Edna Purviance, Jackie Coogan",8.3,"[1920, 1930)"
tt0053291,Certains l'aiment chaud,1959,United States,Billy Wilder,"Marilyn Monroe, Tony Curtis, Jack Lemmon",8.2,"[1950, 1960)"
tt10272386,The Father,2020,United Kingdom,Florian Zeller,"Anthony Hopkins, Olivia Colman, Mark Gatiss",8.2,
tt0042192,Ève...,1950,United States,Joseph L. Mankiewicz,"Bette Davis, Anne Baxter, George Sanders",8.2,"[1950, 1960)"
tt0993846,Le loup de Wall Street,2013,United States,Martin Scorsese,"Leonardo DiCaprio, Jonah Hill, Margot Robbie",8.2,"[2010, 2020)"
tt6966692,Green Book: Sur les routes du sud,2018,United States,Peter Farrelly,"Viggo Mortensen, Mahershala Ali, Linda Cardellini",8.2,"[2010, 2020)"
tt0055031,Jugement à Nuremberg,1961,United States,Stanley Kramer,"Spencer Tracy, Burt Lancaster, Richard Widmark",8.3,"[1960, 1970)"
tt0089881,Ran,1985,Japan,Akira Kurosawa,"Tatsuya Nakadai, Akira Terao, Jinpachi Nezu",8.2,"[1980, 1990)"
tt0112641,Casino,1995,United States,Martin Scorsese,"Robert De Niro, Sharon Stone, Joe Pesci",8.2,"[1990, 2000)"
tt0120382,The Truman Show,1998,United States,Peter Weir,"Jim Carrey, Ed Harris, Laura Linney",8.2,"[1990, 2000)"
tt0469494,There Will Be Blood,2007,United States,Paul Thomas Anderson,"Daniel Day-Lewis, Paul Dano, Ciarán Hinds",8.2,"[2000, 2010)"
tt0457430,Le labyrinthe de Pan,2006,Mexico,Guillermo del Toro,"Ivana Baquero, Ariadna Gil, Sergi López",8.2,"[2000, 2010)"
tt0105695,Impitoyable,1992,United States,Clint Eastwood,"Clint Eastwood, Gene Hackman, Morgan Freeman",8.2,"[1990, 2000)"
tt0167404,Sixième sens,1999,United States,M. Night Shyamalan,"Bruce Willis, Haley Joel Osment, Toni Collette",8.2,"[1990, 2000)"
tt1130884,Shutter Island,2010,United States,Martin Scorsese,"Leonardo DiCaprio, Emily Mortimer, Mark Ruffalo",8.2,"[2010, 2020)"
tt0268978,Un homme d'exception,2001,United States,Ron Howard,"Russell Crowe, Ed Harris, Jennifer Connelly",8.2,"[2000, 2010)"
tt0107290,Jurassic Park,1993,United States,Steven Spielberg,"Sam Neill, Laura Dern, Jeff Goldblum",8.2,"[1990, 2000)"
tt0055630,Le garde du corps,1961,Japan,Akira Kurosawa,"Toshirô Mifune, Eijirô Tôno, Tatsuya Nakadai",8.2,"[1960, 1970)"
tt0040897,Le Trésor de la Sierra Madre,1948,United States,John Huston,"Humphrey Bogart, Walter Huston, Tim Holt",8.2,"[1940, 1950)"
tt0071853,Monty Python : Sacré Graal !,1975,United Kingdom,"Terry Gilliam, Terry Jones","Graham Chapman, John Cleese, Eric Idle",8.2,"[1970, 1980)"
tt0477348,No Country for Old Men,2007,United States,"Ethan Coen, Joel Coen","Tommy Lee Jones, Javier Bardem, Josh Brolin",8.2,"[2000, 2010)"
tt0266697,Kill Bill: Volume I,2003,United States,Quentin Tarantino,"Uma Thurman, David Carradine, Daryl Hannah",8.2,"[2000, 2010)"
tt0057115,La Grande Évasion,1963,United States,John Sturges,"Steve McQueen, James Garner, Richard Attenborough",8.2,"[1960, 1970)"
tt0042876,Rashomon,1950,Japan,Akira Kurosawa,"Toshirô Mifune, Machiko Kyô, Masayuki Mori",8.2,"[1950, 1960)"
tt0084787,The Thing,1982,United States,John Carpenter,"Kurt Russell, Wilford Brimley, Keith David",8.2,"[1980, 1990)"
tt0266543,Le Monde de Nemo,2003,United States,"Andrew Stanton, Lee Unkrich","Albert Brooks, Ellen DeGeneres, Alexander Gould",8.2,"[2000, 2010)"
tt10872600,Spider-Man: No Way Home,2021,United States,Jon Watts,"Tom Holland, Zendaya, Benedict Cumberbatch",8.2,
tt0080678,Elephant Man,1980,United States,David Lynch,"Anthony Hopkins, John Hurt, Anne Bancroft",8.2,"[1980, 1990)"
tt0071315,Chinatown,1974,United States,Roman Polanski,"Jack Nicholson, Faye Dunaway, John Huston",8.2,"[1970, 1980)"
tt0434409,V pour vendetta,2005,United States,James McTeigue,"Hugo Weaving, Natalie Portman, Rupert Graves",8.2,"[2000, 2010)"
tt0081398,Raging Bull,1980,United States,Martin Scorsese,"Robert De Niro, Cathy Moriarty, Joe Pesci",8.1,"[1980, 1990)"
tt0031381,Autant en emporte le vent,1939,United States,"Victor Fleming, George Cukor, Sam Wood","Clark Gable, Vivien Leigh, Thomas Mitchell",8.2,"[1930, 1940)"
tt0120735,"Arnaques, crimes et botanique",1998,United Kingdom,Guy Ritchie,"Jason Flemyng, Dexter Fletcher, Nick Moran",8.2,"[1990, 2000)"
tt0046912,Le crime était presque parfait,1954,United States,Alfred Hitchcock,"Ray Milland, Grace Kelly, Robert Cummings",8.2,"[1950, 1960)"
tt2096673,Vice-versa,2015,United States,"Pete Docter, Ronnie Del Carmen","Amy Poehler, Bill Hader, Lewis Black",8.2,"[2010, 2020)"
tt0347149,Le château ambulant,2004,Japan,Hayao Miyazaki,"Chieko Baisho, Takuya Kimura, Tatsuya Gashûin",8.2,"[2000, 2010)"
tt1305806,Dans ses yeux,2009,Argentina,Juan José Campanella,"Ricardo Darín, Soledad Villamil, Pablo Rago",8.2,"[2000, 2010)"
tt5027774,3 Billboards: Les panneaux de la vengeance,2017,United Kingdom,Martin McDonagh,"Frances McDormand, Woody Harrelson, Sam Rockwell",8.1,"[2010, 2020)"
tt0117951,Trainspotting,1996,United Kingdom,Danny Boyle,"Ewan McGregor, Ewen Bremner, Jonny Lee Miller",8.1,"[1990, 2000)"
tt0050212,Le pont de la rivière Kwaï,1957,United Kingdom,David Lean,"William Holden, Alec Guinness, Jack Hawkins",8.1,"[1950, 1960)"
tt1392214,Prisoners,2013,United States,Denis Villeneuve,"Hugh Jackman, Jake Gyllenhaal, Viola Davis",8.1,"[2010, 2020)"
tt0116282,Fargo,1996,United States,"Joel Coen, Ethan Coen","William H. Macy, Frances McDormand, Steve Buscemi",8.1,"[1990, 2000)"
tt1291584,Warrior,2011,United States,Gavin O'Connor,"Tom Hardy, Nick Nolte, Joel Edgerton",8.2,"[2010, 2020)"
tt1205489,Gran Torino,2008,Germany,Clint Eastwood,"Clint Eastwood, Bee Vang, Christopher Carley",8.1,"[2000, 2010)"
tt0264464,Arrête-moi si tu peux,2002,United States,Steven Spielberg,"Leonardo DiCaprio, Tom Hanks, Christopher Walken",8.1,"[2000, 2010)"
tt0096283,Mon voisin Totoro,1988,Japan,Hayao Miyazaki,"Hitoshi Takagi, Noriko Hidaka, Chika Sakamoto",8.1,"[1980, 1990)"
tt0405159,Million Dollar Baby,2004,United States,Clint Eastwood,"Hilary Swank, Clint Eastwood, Morgan Freeman",8.1,"[2000, 2010)"
tt0118849,Les enfants du ciel,1997,Iran,Majid Majidi,"Mohammad Amir Naji, Amir Farrokh Hashemian, Bahare Seddiqi",8.2,"[1990, 2000)"
tt0083658,Blade Runner,1982,United States,Ridley Scott,"Harrison Ford, Rutger Hauer, Sean Young",8.1,"[1980, 1990)"
tt0015864,La ruée vers l'or,1925,United States,Charles Chaplin,"Charles Chaplin, Mack Swain, Tom Murray",8.1,"[1920, 1930)"
tt4729430,La légende de Klaus,2019,Spain,"Sergio Pablos, Carlos Martínez López","Jason Schwartzman, J.K. Simmons, Rashida Jones",8.2,"[2010, 2020)"
tt1201607,Harry Potter et les Reliques de la Mort : partie 2,2011,United Kingdom,David Yates,"Daniel Radcliffe, Emma Watson, Rupert Grint",8.1,"[2010, 2020)"
tt0112471,Before Sunrise,1995,United States,Richard Linklater,"Ethan Hawke, Julie Delpy, Andrea Eckert",8.1,"[1990, 2000)"
tt2024544,12 Years a Slave,2013,United States,Steve McQueen,"Chiwetel Ejiofor, Michael Kenneth Williams, Michael Fassbender",8.1,"[2010, 2020)"
tt0052618,Ben-Hur,1959,United States,William Wyler,"Charlton Heston, Jack Hawkins, Stephen Boyd",8.1,"[1950, 1960)"
tt2278388,The Grand Budapest hotel,2014,United States,Wes Anderson,"Ralph Fiennes, F. Murray Abraham, Mathieu Amalric",8.1,"[2010, 2020)"
tt0047296,Sur les quais...,1954,United States,Elia Kazan,"Marlon Brando, Karl Malden, Lee J. Cobb",8.1,"[1950, 1960)"
tt2267998,Gone Girl,2014,United States,David Fincher,"Ben Affleck, Rosamund Pike, Neil Patrick Harris",8.1,"[2010, 2020)"
tt10366206,John Wick: Chapitre 4,2023,United States,Chad Stahelski,"Keanu Reeves, Laurence Fishburne, George Georgiou",8.3,
tt0050986,Les fraises sauvages,1957,Sweden,Ingmar Bergman,"Victor Sjöström, Bibi Andersson, Ingrid Thulin",8.1,"[1950, 1960)"
tt0017925,Le mécano de la Générale,1926,United States,"Clyde Bruckman, Buster Keaton","Buster Keaton, Marion Mack, Glen Cavender",8.1,"[1920, 1930)"
tt0072684,Barry Lyndon,1975,United Kingdom,Stanley Kubrick,"Ryan O'Neal, Marisa Berenson, Patrick Magee",8.1,"[1970, 1980)"
tt0107207,Au nom du père,1993,Ireland,Jim Sheridan,"Daniel Day-Lewis, Pete Postlethwaite, Alison Crosbie",8.1,"[1990, 2000)"
tt0077416,Voyage au bout de l'enfer,1978,United States,Michael Cimino,"Robert De Niro, Christopher Walken, John Cazale",8.1,"[1970, 1980)"
tt2119532,Tu ne tueras point,2016,Australia,Mel Gibson,"Andrew Garfield, Sam Worthington, Luke Bracey",8.1,"[2010, 2020)"
tt0041959,Le troisième homme,1949,United Kingdom,Carol Reed,"Orson Welles, Joseph Cotten, Alida Valli",8.1,"[1940, 1950)"
tt0046268,Le salaire de la peur,1953,France,Henri-Georges Clouzot,"Yves Montand, Charles Vanel, Peter van Eyck",8.2,"[1950, 1960)"
tt0353969,Memories of Murder,2003,South Korea,Bong Joon Ho,"Song Kang-ho, Kim Sang-kyung, Roe-ha Kim",8.1,"[2000, 2010)"
tt3011894,Les Nouveaux Sauvages,2014,Argentina,Damián Szifron,"Darío Grandinetti, María Marull, Mónica Villa",8.1,"[2010, 2020)"
tt0015324,Sherlock Junior,1924,United States,Buster Keaton,"Buster Keaton, Kathryn McGuire, Joe Keaton",8.2,"[1920, 1930)"
tt0031679,Mr. Smith au sénat,1939,United States,Frank Capra,"James Stewart, Jean Arthur, Claude Rains",8.1,"[1930, 1940)"
tt1392190,Mad Max: Fury Road,2015,Australia,George Miller,"Tom Hardy, Charlize Theron, Nicholas Hoult",8.1,"[2010, 2020)"
tt0978762,Mary et Max.,2009,Australia,Adam Elliot,"Toni Collette, Philip Seymour Hoffman, Eric Bana",8.1,"[2000, 2010)"
tt0892769,Dragons,2010,United States,"Dean DeBlois, Chris Sanders","Jay Baruchel, Gerard Butler, Christopher Mintz-Plasse",8.1,"[2010, 2020)"
tt0050976,Le septième sceau,1957,Sweden,Ingmar Bergman,"Max von Sydow, Gunnar Björnstrand, Bengt Ekerot",8.1,"[1950, 1960)"
