id,Titre,Date,Pays,Director,acteurs,note,Decennie
tt0198781,Monstres & Cie,2001,United States,"Pete Docter, David Silverman, Lee Unkrich","Billy Crystal, John Goodman, Mary Gibbs",8.1,"[2000, 2010)"
tt0097165,Le Cercle des poètes disparus,1989,United States,Peter Weir,"Robin Williams, Robert Sean Leonard, Ethan Hawke",8.1,"[1980, 1990)"
tt0073195,Les Dents de la mer,1975,United States,Steven Spielberg,"Roy Scheider, Robert Shaw, Richard Dreyfuss",8.1,"[1970, 1980)"
tt3170832,Room,2015,Ireland,Lenny Abrahamson,"Brie Larson, Jacob Tremblay, Sean Bridgers",8.1,"[2010, 2020)"
tt0118715,The Big Lebowski,1998,United States,"Joel Coen, Ethan Coen","Jeff Bridges, John Goodman, Julianne Moore",8.1,"[1990, 2000)"
tt0046438,Voyage à Tokyo,1953,Japan,Yasujirô Ozu,"Chishû Ryû, Chieko Higashiyama, Sô Yamamura",8.2,"[1950, 1960)"
tt0019254,La passion de Jeanne d'Arc,1928,France,Carl Theodor Dreyer,"Maria Falconetti, Eugene Silvain, André Berley",8.2,"[1920, 1930)"
tt1950186,Le Mans '66,2019,United States,James Mangold,"Matt Damon, Christian Bale, Jon Bernthal",8.1,"[2010, 2020)"
tt0395169,Hôtel Rwanda,2004,United Kingdom,Terry George,"Don Cheadle, Sophie Okonedo, Joaquin Phoenix",8.1,"[2000, 2010)"
tt0075148,Rocky,1976,United States,John G. Avildsen,"Sylvester Stallone, Talia Shire, Burt Young",8.1,"[1970, 1980)"
tt0382932,Ratatouille,2007,United States,"Brad Bird, Jan Pinkava","Brad Garrett, Lou Romano, Patton Oswalt",8.1,"[2000, 2010)"
tt0091763,Platoon,1986,United States,Oliver Stone,"Charlie Sheen, Tom Berenger, Willem Dafoe",8.1,"[1980, 1990)"
tt1895587,Spotlight,2015,United States,Tom McCarthy,"Mark Ruffalo, Michael Keaton, Rachel McAdams",8.1,"[2010, 2020)"
tt3315342,Logan,2017,United States,James Mangold,"Hugh Jackman, Patrick Stewart, Dafne Keen",8.1,"[2010, 2020)"
tt0088247,Terminator,1984,United Kingdom,James Cameron,"Arnold Schwarzenegger, Linda Hamilton, Michael Biehn",8.1,"[1980, 1990)"
tt0092005,Stand by Me : Compte sur moi,1986,United States,Rob Reiner,"Wil Wheaton, River Phoenix, Corey Feldman",8.1,"[1980, 1990)"
tt1979320,Rush,2013,United Kingdom,Ron Howard,"Daniel Brühl, Chris Hemsworth, Olivia Wilde",8.1,"[2010, 2020)"
tt0074958,Network - Main basse sur la TV,1976,United States,Sidney Lumet,"Faye Dunaway, William Holden, Peter Finch",8.1,"[1970, 1980)"
tt0381681,Before Sunset,2004,United States,Richard Linklater,"Ethan Hawke, Julie Delpy, Vernon Dobtcheff",8.1,"[2000, 2010)"
tt0758758,Into the Wild,2007,United States,Sean Penn,"Emile Hirsch, Vince Vaughn, Catherine Keener",8.1,"[2000, 2010)"
tt0032138,Le magicien d'Oz,1939,United States,"Victor Fleming, George Cukor, Mervyn LeRoy","Judy Garland, Frank Morgan, Ray Bolger",8.1,"[1930, 1940)"
tt0036868,Les Plus Belles Années de notre vie,1946,United States,William Wyler,"Myrna Loy, Dana Andrews, Fredric March",8.1,"[1940, 1950)"
tt0070047,L'Exorciste,1973,United States,William Friedkin,"Ellen Burstyn, Max von Sydow, Linda Blair",8.1,"[1970, 1980)"
tt0107048,Un jour sans fin,1993,United States,Harold Ramis,"Bill Murray, Andie MacDowell, Chris Elliott",8.1,"[1990, 2000)"
tt0317705,Les Indestructibles,2004,United States,Brad Bird,"Craig T. Nelson, Samuel L. Jackson, Holly Hunter",8.0,"[2000, 2010)"
tt0035446,Jeu dangereux,1942,United States,Ernst Lubitsch,"Carole Lombard, Jack Benny, Robert Stack",8.2,"[1940, 1950)"
tt0113247,La haine,1995,France,Mathieu Kassovitz,"Vincent Cassel, Hubert Koundé, Saïd Taghmaoui",8.1,"[1990, 2000)"
tt0325980,Pirates des Caraïbes : La malédiction du Black Pearl,2003,United States,Gore Verbinski,"Johnny Depp, Geoffrey Rush, Orlando Bloom",8.1,"[2000, 2010)"
tt0058946,La bataille d'Alger,1966,Italy,Gillo Pontecorvo,"Brahim Hadjadj, Jean Martin, Yacef Saadi",8.1,"[1960, 1970)"
tt1028532,Hatchi,2009,United Kingdom,Lasse Hallström,"Richard Gere, Joan Allen, Cary-Hiroyuki Tagawa",8.1,"[2000, 2010)"
tt0032551,Les raisins de la colère,1940,United States,John Ford,"Henry Fonda, Jane Darwell, John Carradine",8.1,"[1940, 1950)"
tt0048473,La complainte du sentier,1955,India,Satyajit Ray,"Kanu Bannerjee, Karuna Bannerjee, Subir Banerjee",8.3,"[1950, 1960)"
tt0476735,Mon père et mon fils,2005,Turkey,Çagan Irmak,"Çetin Tekindor, Fikret Kuskan, Hümeyra",8.2,"[2000, 2010)"
tt0245712,Amours chiennes,2000,Mexico,Alejandro G. Iñárritu,"Emilio Echevarría, Gael García Bernal, Goya Toledo",8.1,"[2000, 2010)"
tt15097216,Jai Bhim,2021,India,T.J. Gnanavel,"Suriya, Lijo Mol Jose, Manikandan K.",8.8,
tt0032976,Rebecca,1940,United States,Alfred Hitchcock,"Laurence Olivier, Joan Fontaine, George Sanders",8.1,"[1940, 1950)"
tt4016934,Mademoiselle,2016,South Korea,Park Chan-wook,"Kim Min-hee, Ha Jung-woo, Cho Jin-woong",8.1,"[2010, 2020)"
tt0061512,Luke la main froide,1967,United States,Stuart Rosenberg,"Paul Newman, George Kennedy, Strother Martin",8.1,"[1960, 1970)"
tt0059742,La mélodie du bonheur,1965,United States,Robert Wise,"Julie Andrews, Christopher Plummer, Eleanor Parker",8.1,"[1960, 1970)"
tt0025316,New York - Miami,1934,United States,Frank Capra,"Clark Gable, Claudette Colbert, Walter Connolly",8.1,"[1930, 1940)"
tt0053198,Les Quatre Cents Coups,1959,France,François Truffaut,"Jean-Pierre Léaud, Albert Rémy, Claire Maurier",8.1,"[1950, 1960)"
tt0060827,Persona,1966,Sweden,Ingmar Bergman,"Bibi Andersson, Liv Ullmann, Margaretha Krook",8.1,"[1960, 1970)"
tt0079470,Monty Python : La Vie de Brian,1979,United Kingdom,Terry Jones,"Graham Chapman, John Cleese, Michael Palin",8.0,"[1970, 1980)"
tt0129167,Le géant de fer,1999,United States,Brad Bird,"Eli Marienthal, Harry Connick Jr., Jennifer Aniston",8.1,"[1990, 2000)"
tt1454029,La couleur des sentiments,2011,United States,Tate Taylor,"Viola Davis, Emma Stone, Octavia Spencer",8.1,"[2010, 2020)"
tt0103639,Aladdin,1992,United States,"Ron Clements, John Musker","Scott Weinger, Robin Williams, Linda Larkin",8.0,"[1990, 2000)"
tt0071411,Dersou Ouzala,1975,Soviet Union,Akira Kurosawa,"Maksim Munzuk, Yuriy Solomin, Mikhail Bychkov",8.2,"[1970, 1980)"
tt0099348,Danse avec les loups,1990,United States,Kevin Costner,"Kevin Costner, Mary McDonnell, Graham Greene",8.0,"[1990, 2000)"
